{
  "$schema": "http://json-schema.org/draft-07/schema#",
  "type": "object",
  "required": [
    "lessonName",
    "lessonDescription",
    "lessonLevel",
    "languagePair",
    "items",
    "lessonType",
    "tags",
    "difficulty"
  ],
  "properties": {
    "lessonName": {
      "type": "string",
      "description": "The name of the lesson"
    },
    "lessonDescription": {
      "type": "string",
      "description": "A detailed description of the lesson content and objectives"
    },
    "lessonLevel": {
      "type": "string",
      "enum": ["beginner", "intermediate", "advanced"],
      "description": "The difficulty level of the lesson"
    },
    "lessonType": {
      "type": "string",
      "description": "The type or category of the lesson"
    },
    "tags": {
      "type": "array",
      "items": {
        "type": "string"
      },
      "description": "Categories and attributes associated with the lesson"
    },
    "difficulty": {
      "type": "integer",
      "minimum": 1,
      "maximum": 5,
      "description": "Overall difficulty rating of the lesson"
    },
    "languagePair": {
      "type": "object",
      "required": ["target", "native"],
      "properties": {
        "target": {
          "type": "object",
          "required": ["code", "name", "nativeName", "script"],
          "properties": {
            "code": {
              "type": "string",
              "description": "ISO language code"
            },
            "name": {
              "type": "string",
              "description": "Language name in English"
            },
            "nativeName": {
              "type": "string",
              "description": "Language name in its native script"
            },
            "script": {
              "type": "string",
              "description": "Writing system used by the language"
            }
          }
        },
        "native": {
          "type": "object",
          "required": ["code", "name", "nativeName"],
          "properties": {
            "code": {
              "type": "string",
              "description": "ISO language code"
            },
            "name": {
              "type": "string",
              "description": "Language name in English"
            },
            "nativeName": {
              "type": "string",
              "description": "Language name in its native script"
            }
          }
        }
      }
    },
    "items": {
      "type": "array",
      "items": {
        "type": "object",
        "required": ["id", "text", "translation", "romanization", "examples"],
        "properties": {
          "id": {
            "type": "string",
            "description": "Unique identifier for the vocabulary item"
          },
          "text": {
            "type": "string",
            "description": "The vocabulary word in Thai script"
          },
          "translation": {
            "type": "string",
            "description": "English translation of the word"
          },
          "romanization": {
            "type": "string",
            "description": "Romanized pronunciation of the Thai word"
          },
          "difficulty": {
            "type": "integer",
            "minimum": 1,
            "maximum": 5,
            "description": "Difficulty rating of the vocabulary item"
          },
          "tags": {
            "type": "array",
            "items": {
              "type": "string"
            },
            "minItems": 1,
            "description": "Categories and attributes associated with the vocabulary item"
          },
          "examples": {
            "type": "array",
            "items": {
              "type": "object",
              "required": ["text", "translation", "romanization"],
              "properties": {
                "text": {
                  "type": "string",
                  "description": "Example sentence in Thai script"
                },
                "translation": {
                  "type": "string",
                  "description": "English translation of the example sentence"
                },
                "romanization": {
                  "type": "string",
                  "description": "Romanized pronunciation of the example sentence"
                }
              }
            },
            "minItems": 2,
            "description": "Array of example sentences using the vocabulary word"
          }
        }
      },
      "minItems": 15,
      "description": "Array of vocabulary items included in the lesson"
    }
  }
}
